id,package,review,merged_main,merged_second
7c2a7047-afc9-11e6-ba6d-c4b301cdf627,com.danvelazco.fbwrapper,updatedstill new to this so will rate again but updated having to uninstall sadly because it crashes every time i try to open messaging not uninstalling for that alone thats kind of the last straw previous 3 stars so far i like the idea and intent but like some others have mentioned push notifications would be great plus ive had a couple use problems already in first day including having the app choke while trying to post a picture and shutting down entirely when trying to access the message section well see how things continue,feature,
7c2a710c-afc9-11e6-9316-c4b301cdf627,com.danvelazco.fbwrapper,unstable great idea but force closes pretty constantly,not meaningful,
7c2a721c-afc9-11e6-9dc5-c4b301cdf627,com.danvelazco.fbwrapper,messages crashes,feature,
7c2a7511-afc9-11e6-bf96-c4b301cdf627,com.danvelazco.fbwrapper,works well when its not force closing this app wont run longer than 15 minutes without fc i would prefer to use this app instead of the official fb app but its so annoying to have it fcing all the time,not meaningful,
7c2a764a-afc9-11e6-9578-c4b301cdf627,com.danvelazco.fbwrapper,app just kept crashing maybe try doing a little more quality control before putting it out for installmine kept crashinguninstalled,not meaningful,
7c2a76c2-afc9-11e6-b625-c4b301cdf627,com.danvelazco.fbwrapper,love it but messenger crashes the app and closes it messenger worked only once fix this asap,not meaningful,
7c2a77c7-afc9-11e6-ab52-c4b301cdf627,com.danvelazco.fbwrapper,crashed constantly i really liked the idea behind it and thought the app was useful but it crashed constantly particularly when i tried to send or read messages had to uninstall it as it became unusable,feature,
7c2a7938-afc9-11e6-b42c-c4b301cdf627,com.danvelazco.fbwrapper,crashes accessing messages i like this app but it crashes trying to access messages,feature,
7c2a79c5-afc9-11e6-9d75-c4b301cdf627,com.danvelazco.fbwrapper,keeps crashing app keeps crashing when i press the messages tab on the top,feature,
7c2a7a45-afc9-11e6-876e-c4b301cdf627,com.danvelazco.fbwrapper,great app but guessing fb have changed something as it now crashes when accessing messages,feature,
7c2a7cf8-afc9-11e6-aa94-c4b301cdf627,com.danvelazco.fbwrapper,message access denied no longer can access messages from this app app crashes and force closes when inbox is accessed got to fix this issue,feature,
7c2a7f00-afc9-11e6-abae-c4b301cdf627,com.danvelazco.fbwrapper,good except for messages the app was a real good alternative to facebook i hate that facebook was root installed on my new phone i immediately switched to this app a few months back the messages part stopped working and the app crashes when i try to access that part,feature,
7c2a8005-afc9-11e6-95f4-c4b301cdf627,com.danvelazco.fbwrapper,crashes when trying to view messages the newsfeed and notifications work fine but selecting the message icon crashes the app,feature,
7c2a8085-afc9-11e6-8edb-c4b301cdf627,com.danvelazco.fbwrapper,messenger function crashing this seems lighter weight than fb but the sole reason i tried it didnt workthe messenger function crashes upon switching to that tab,feature,
7c2a8107-afc9-11e6-9ce8-c4b301cdf627,com.danvelazco.fbwrapper,crashes on messages overall functionality and stability seem better than the major alternatives ive tried metal folio etc the only problem is this app crashes when you try to access your messages in mobile or auto mode so i have to switch to basic or desktop whenever i want to access fb messages still beats the godawful fb messenger app,feature,
7c2a820c-afc9-11e6-b8a9-c4b301cdf627,com.danvelazco.fbwrapper,too bad for just a web view app is pretty nice althought it constantly freezes and crashes on my htc m9 making it impossible to use dislike,not meaningful,
7c2a828c-afc9-11e6-90b6-c4b301cdf627,com.danvelazco.fbwrapper,app crash when i tried to open my message it crashed,feature,
7c2a8307-afc9-11e6-95bb-c4b301cdf627,com.danvelazco.fbwrapper,messaging needs a fix crashing every time i try to see messages,feature,
7c2a86c5-afc9-11e6-b0fe-c4b301cdf627,com.danvelazco.fbwrapper,messages tab crashes the app turns out this is caused by facebook mobile site no longer having messages support it would be nice if it didnt crash disaim app works great for facebook messenger though,feature,
7c2a875c-afc9-11e6-b6a2-c4b301cdf627,com.danvelazco.fbwrapper,please fix so everyone is having the same issues with the messaging this was my go to fb app and now i cant even use it anymore without it crashing please do an update to resolve these problems please,feature,
7c2a89d1-afc9-11e6-aa79-c4b301cdf627,com.danvelazco.fbwrapper,needs some work the app crashes whenever i click on the message tab i tried unusual and reinstall as well to no avail used to work great i love not being notified by facebook and i like the app it just needs some maintenance,feature,
7c2a8bcf-afc9-11e6-9278-c4b301cdf627,com.danvelazco.fbwrapper,didnt work for what i needed it for facebook has decided to try and force users to use their messenger app even from the mobile site i never used the facebook app and now i cant view any of my private messages on my phones browser i was hoping this app could fix that but every time i click on the private message notification it crashes i blame facebook for this i cannot even think of a word colorful enough for what they are,feature,
7c2a8cca-afc9-11e6-9576-c4b301cdf627,com.danvelazco.fbwrapper,useless fails at delivering basic functionality crashes at will,not meaningful,
7c2a8ef0-afc9-11e6-ac64-c4b301cdf627,com.danvelazco.fbwrapper,crash its crashes when ever i click on messages,feature,resource management
7c2a8feb-afc9-11e6-8566-c4b301cdf627,com.danvelazco.fbwrapper,trying to see a message makes it crash i got this to avoid facebook messenger this app is utterly useless for me every time i tap the message icon to read a message the app crashes galaxy note 5dont know if its the app or my phone im very disappointed,feature,resource management
7c2a90b3-afc9-11e6-9254-c4b301cdf627,com.danvelazco.fbwrapper,works but messages hasnt been working for awhile it force crashes when i try to access them,feature,resource management
7c2a9147-afc9-11e6-ba38-c4b301cdf627,com.danvelazco.fbwrapper,works great except for messages facebook tries to force you to upgrade to messenger when you click on messages but it promptly crashes the app need to figure out a way around that,feature,resource management
7c2a91ca-afc9-11e6-8165-c4b301cdf627,com.danvelazco.fbwrapper,inbox i adore tinfoil but today whenever i tried to enter my inbox tinfoil crashed does it have something to do with messenger i certainly hope that we wont need to use messenger,feature,resource management
7c2a92c2-afc9-11e6-8233-c4b301cdf627,com.danvelazco.fbwrapper,love it but love this app but it crashes every single time you click on the messages tab,feature,resource management
7c2a934f-afc9-11e6-a00f-c4b301cdf627,com.danvelazco.fbwrapper,carolyn keeps force closing,not meaningful,
7c2a93fa-afc9-11e6-85c2-c4b301cdf627,com.danvelazco.fbwrapper,getting worse uploading multiple pictures is a massive problem choosing one pic at a time is annoying especially if youve a whole album to upload and it times out after picking them all one at a time edit opening messages now crashes the application every time itd be 4 stars of these issues were fixed,resource management,
7c2a9507-afc9-11e6-8cdd-c4b301cdf627,com.danvelazco.fbwrapper,crashes frequently crashes when accessing pms or attempting to pm,feature,resource management
7c2a9580-afc9-11e6-bb5c-c4b301cdf627,com.danvelazco.fbwrapper,loved until no more messages this was my fix for not wanting fb messenger in order to use messages doing so now causes the app to crash on samsung galaxy s3,feature,resource management
7c2a9602-afc9-11e6-aa72-c4b301cdf627,com.danvelazco.fbwrapper,problem trying to access messages in the app now causes a crash also the translation buttons on comments to a post do not work,feature,resource management
7c2a96fa-afc9-11e6-8533-c4b301cdf627,com.danvelazco.fbwrapper,force closes force closes when trying to read messages,feature,resource management
7c2a97f5-afc9-11e6-ae2a-c4b301cdf627,com.danvelazco.fbwrapper,awesome app fb is shutting down messenger in mobile view it crashes in forced fb lite it still functions android 6 fb keeps getting no internet signal 1st world problems,feature,resource management
7c2a9875-afc9-11e6-8dfd-c4b301cdf627,com.danvelazco.fbwrapper,nice app please fix the link between messenger and tinfoil as it just crashes every time,feature,resource management
7c2a9d63-afc9-11e6-8bd1-c4b301cdf627,com.danvelazco.fbwrapper,very nice good way to prevent facebook from having their way with your phones battery crashes every time i want to tap messenger but i have many other means of communication so it doesnt bother me too much,feature,resource management
7c2a9f59-afc9-11e6-b030-c4b301cdf627,com.danvelazco.fbwrapper,unusable it crashes all the time and its the only app that does this to me i dont like the regular facebook app due to how powerhungry and data hungry it is this should be the perfect alternative but for a long time it has been crashing constantly and i give up,not meaningful,
7c2aa051-afc9-11e6-8cdc-c4b301cdf627,com.danvelazco.fbwrapper,facebook chat crashes this was a great app the chat crashes everyone on all my devices,feature,
7c2aa157-afc9-11e6-a663-c4b301cdf627,com.danvelazco.fbwrapper,crashes every time i click on unread messages icon,feature,resource management
7c2aa1d7-afc9-11e6-9762-c4b301cdf627,com.danvelazco.fbwrapper,why does it crash when i have messages,feature,resource management
7c2aa25c-afc9-11e6-9c66-c4b301cdf627,com.danvelazco.fbwrapper,messages tab crashing application cant access messages at all not sure when it started but crashes 100 of the time,feature,resource management
7c2aa2d1-afc9-11e6-b270-c4b301cdf627,com.danvelazco.fbwrapper,crashes when click messages when i click on the messages icon tinfoil crashes,feature,resource management
7c2aa3d7-afc9-11e6-9539-c4b301cdf627,com.danvelazco.fbwrapper,messenger stopped working i liked this app because of the lack of permissions and the inclusion of messenger in a single app however recently the messenger function stopped working whenever i select messenger the app closes and says unfortunately tinfoil has stopped,feature,resource management
7c2aa5ab-afc9-11e6-8c55-c4b301cdf627,com.danvelazco.fbwrapper,crashes upon opening private messages other than that it is good,feature,resource management
7c2aa62e-afc9-11e6-ae51-c4b301cdf627,com.danvelazco.fbwrapper,great potential but messages dont work it crashes every time i open the messages,feature,resource management
7c2aa728-afc9-11e6-a444-c4b301cdf627,com.danvelazco.fbwrapper,good app because doesnt consume much resources but crashes when i click on message link to send a message to a personood app because doesnt consume much resources but crashes when i click on,feature,resource management
7c2aa7b3-afc9-11e6-85f6-c4b301cdf627,com.danvelazco.fbwrapper,crashes when i try to view messages,feature,resource management
7c2aa82e-afc9-11e6-b804-c4b301cdf627,com.danvelazco.fbwrapper,was working great til a few weeks ago on my htc one m8 now when i try to read messages the app just crashes every time i have still give it 5 stars because the app is so light on my battery compared to facebook and messenger please fix this minor issue developer as having the inapp messaging is what makes this app so great along with saving battery life peace,feature,resource management
7c2aa8b8-afc9-11e6-be8b-c4b301cdf627,com.danvelazco.fbwrapper,better than the official app whats up with messaging though the app crashes when i try to access my messages,feature,resource management
7c2aa93a-afc9-11e6-b833-c4b301cdf627,com.danvelazco.fbwrapper,not bad but some flaws works fairly well for the most part but crashes every time i try to open messages every time its completely up to date too,feature,resource management
7c2aa9b0-afc9-11e6-b90c-c4b301cdf627,com.danvelazco.fbwrapper,it was great since last update cant open messages as app crashes every time,feature,resource management
7c2aaa35-afc9-11e6-8397-c4b301cdf627,com.danvelazco.fbwrapper,messaging crashes the app any time i check my messages tinfoil immediately closes,feature,resource management
7c2aab2e-afc9-11e6-b13a-c4b301cdf627,com.danvelazco.fbwrapper,great app one bug whenever i try opening a message the app crashes and this new but i think its because facebook is punishing people who are not using there official app,feature,resource management
7c2aaba6-afc9-11e6-89f3-c4b301cdf627,com.danvelazco.fbwrapper,best app for facebook force closes when trying to start a message but still love it,feature,resource management
7c2aac26-afc9-11e6-aea3-c4b301cdf627,com.danvelazco.fbwrapper,got this to avoid messenger fcs all day i can no longer use this app to check my messages theres really no reason for me to keep this app any longer because every time i try to open my messages it force closes on me,feature,resource management
7c2aacab-afc9-11e6-a204-c4b301cdf627,com.danvelazco.fbwrapper,cant access messages without app fcing one of the best simple facebook apps but recently its been force closing and crashing as soon as i open the messages tab both on the browser and in the actual app i love the app but if this issue is fixed i wont need to keep a tab on chrome open,feature,resource management
7c2aad21-afc9-11e6-be8c-c4b301cdf627,com.danvelazco.fbwrapper,uninstalled almost every time upon opening the app it crashes worked perfectly prior ive sent you multiple crash reports reply uninstalling your lack of a fix for so long,feature,
7c2aade8-afc9-11e6-a55f-c4b301cdf627,com.danvelazco.fbwrapper,messaging is still broken application crashes 100 of the time when trying to access messages its been weeks now is nothing really being done about this,feature,resource management
7c2aae75-afc9-11e6-8252-c4b301cdf627,com.danvelazco.fbwrapper,crashes crashes when i open messages,feature,resource management
7c2aaff0-afc9-11e6-8a70-c4b301cdf627,com.danvelazco.fbwrapper,messaging no longer works used to work great now crashes every time i try to open messages,feature,resource management
7c2ab178-afc9-11e6-90fa-c4b301cdf627,com.danvelazco.fbwrapper,messages no longer work i absolutely love this app however trying to open the message tab now appears to crash the app,feature,resource management
7c2ab3a8-afc9-11e6-9cda-c4b301cdf627,com.danvelazco.fbwrapper,crashes when trying to message crashes everytime when i click on message otherwise 5 star so please fix,feature,resource management
7c2ab41e-afc9-11e6-b313-c4b301cdf627,com.danvelazco.fbwrapper,private messages forced closed tinfoil crashes now when you click on the private message icon this started happening only recently so facebook must have changed something on the backend,feature,resource management
7c2ab719-afc9-11e6-ae63-c4b301cdf627,com.danvelazco.fbwrapper,messages makes it crash this app used to be good used it all the time and didnt drain my battery but now whenever i want to open the messages tab that it just closes down please fix this and it will be five stars again,feature,resource management
7c2ab799-afc9-11e6-86b2-c4b301cdf627,com.danvelazco.fbwrapper,inbox keeps crashing now everytime i open inbox the app crashes,feature,resource management
7c2aba68-afc9-11e6-9e97-c4b301cdf627,com.danvelazco.fbwrapper,crashes whenever trying to see messages this can be avoided by requesting desktop version on the browser maybe you can work on a way of bypassing this,feature,resource management
7c2abaeb-afc9-11e6-a6e7-c4b301cdf627,com.danvelazco.fbwrapper,inbox not working touching inbox causes the app to crash since last update,feature,resource management
7c2abce1-afc9-11e6-898a-c4b301cdf627,com.danvelazco.fbwrapper,quick fix for messages crash slide in from the right go to preferences and use either desktop version or basic version seems fb is trying to force messenger on everyone hopefully issue can be resolved soon,feature,resource management
7c2abd61-afc9-11e6-b224-c4b301cdf627,com.danvelazco.fbwrapper,crashes when i try to see messages i will love this if i can read my messages,feature,resource management
7c2abed4-afc9-11e6-84fd-c4b301cdf627,com.danvelazco.fbwrapper,well done works as advertised any issues you may experience are usually fb mobile site issues crashing is due to fb forcing fb messenger on users you can only see messages via the fb messenger app now not devs fault blame zuckerberg thanks dev nice and clean the only thing id want is a darknight mode,feature,resource management
7c2abfcc-afc9-11e6-b8b4-c4b301cdf627,com.danvelazco.fbwrapper,too many glitches ubninstalling due to too many issues used to allow me on messages now it crashes every time could never upload pictures found a facebook wrap around that still allows these functions it was good while it lasted,feature,resource management
7c2ac051-afc9-11e6-b880-c4b301cdf627,com.danvelazco.fbwrapper,damn facebook they blocked messaging this app is perfect for me only problem is since last week it crashes when i try to open any message does anybody have a workaround i would really love to be able to keep using just this app without any hassle,feature,resource management
7c2ac0c7-afc9-11e6-8fc9-c4b301cdf627,com.danvelazco.fbwrapper,crashes every time i open messages can we not find a workaround,feature,resource management
7c2ac321-afc9-11e6-9feb-c4b301cdf627,com.danvelazco.fbwrapper,i downloaded tinfoil when facebook made messenger unavailable through their mobile site since i refuse to download their official app unfortunately facebook seems to have broken tinfoils messaging functionality as well since the app crashes whenever i try to access my messenges other than that it seems like a great app so ill definitely give it another try if you find a workaround for facebooks pushiness,feature,resource management
7c2ac3a1-afc9-11e6-8e10-c4b301cdf627,com.danvelazco.fbwrapper,crashes everything was great until it starelted crashing when i click on messages,feature,resource management
7c2ac49c-afc9-11e6-81a5-c4b301cdf627,com.danvelazco.fbwrapper,crashing crashes every time i try to check messages,feature,resource management
7c2ac51e-afc9-11e6-b584-c4b301cdf627,com.danvelazco.fbwrapper,has a few bugs as of recent the app was working great but now crashes once the refresh button is pressed and will sometimes crash on startup also the cover photo on a profile page seems to show partially displaying black on the bottom half of the image,feature,resource management
7c2ac617-afc9-11e6-8e45-c4b301cdf627,com.danvelazco.fbwrapper,messaging keeps crashing essaging keeps cr,feature,resource management
7c2ac711-afc9-11e6-af34-c4b301cdf627,com.danvelazco.fbwrapper,cannot use messages cannot read or send messages keeps crashing facebook is pushing its messaging app can we make a tinfoil for that too love this app otherwise,feature,resource management
7c2ac80c-afc9-11e6-af57-c4b301cdf627,com.danvelazco.fbwrapper,mostly wonderful i would previously have given it five stars but recently it has crashed every time that i click on the messaging icon,feature,resource management
7c2ac88f-afc9-11e6-a2ba-c4b301cdf627,com.danvelazco.fbwrapper,normally a great app i have been using tinfoil since i first started using facebook many years ago and love it i just upgraded to android 6 and suddenly it crashes whenever i try and open my messages i dont want to use any other facebook app i would normally rate this 5 stars,feature,resource management
7c2aca00-afc9-11e6-afa1-c4b301cdf627,com.danvelazco.fbwrapper,i have been using and enjoying this app for quite some time however just this week it has quit allowing me to view my messages every time i click on messages it crashes this is the main reason i use this app as i did not want to use the separate messenger from facebook so i hope this is fixed soon,feature,resource management
7c2aca80-afc9-11e6-83ea-c4b301cdf627,com.danvelazco.fbwrapper,fix please are you planning a fix for it crashing when opening messages will happily go back to 5 stars once fixed but uninstalling for now,feature,resource management
7c2acb40-afc9-11e6-b918-c4b301cdf627,com.danvelazco.fbwrapper,app crashes while trying to access messages cant access fb messages lg g3 marshmallow,feature,resource management
7c2acbde-afc9-11e6-9c08-c4b301cdf627,com.danvelazco.fbwrapper,opening messages now crash the app fix incoming,feature,resource management
7c2accd9-afc9-11e6-8332-c4b301cdf627,com.danvelazco.fbwrapper,like the idea but buggy crashes every time i try to access messages other than that app is decent replacement if you dont want the resource hog official app lg g3,feature,resource management
7c2acd5c-afc9-11e6-bc0e-c4b301cdf627,com.danvelazco.fbwrapper,app crash on messages app ceashes now on messages,feature,resource management
7c2acecf-afc9-11e6-b2be-c4b301cdf627,com.danvelazco.fbwrapper,loved 5 stars until now 1 star useless keeps crashing on me every time i open the app this has just started loved the app up until now i have uninstalled and reinstalled no luck samsung note 3,feature,
7c2ad005-afc9-11e6-b721-c4b301cdf627,com.danvelazco.fbwrapper,great alternative to facebookmessenger noticed that on nexus 6p that the app crashes when you click on the message tab,feature,resource management
7c2ad085-afc9-11e6-8d52-c4b301cdf627,com.danvelazco.fbwrapper,great app but love this app until recently biggest is it crashes everytime i try to access messages havent been able to access for a week or so i installed this app primarily because i dont want to install messanger and enjoy the space saving so may stop using if not fixed i unistalled and reinstalled and still crashing also tagging isnt consistent sometimes you can sometimes you cant otherwise liked the app and would have given 4 stars note5 user,feature,resource management
7c2ad111-afc9-11e6-9028-c4b301cdf627,com.danvelazco.fbwrapper,chat crashes app i cant send messages anymore with this app it immediately crashes tried clearing cache but still happens,feature,resource management
7c2ad554-afc9-11e6-951e-c4b301cdf627,com.danvelazco.fbwrapper,great app the app is a pretty good substitute unfortunately it crashes when clicking on the chat navigation item,feature,resource management
7c2ad5d7-afc9-11e6-834e-c4b301cdf627,com.danvelazco.fbwrapper,now it crashes any time i try to check notifications uninstalled and reinstalled still immediately causes the app to crash on a samsung galaxy s4 running android 43,feature,resource management
7c2ad657-afc9-11e6-bcd9-c4b301cdf627,com.danvelazco.fbwrapper,great app but recently crashes when trying to go to messages on fb although it is hard to say if its the app or fb causing the issue,feature,resource management
7c2ad6d1-afc9-11e6-a0dd-c4b301cdf627,com.danvelazco.fbwrapper,its randomly started to crash ive used this app for ages and never had any issues but for some reason today its crashing everytime i click on something,not meaningful,
7c2ad751-afc9-11e6-8fe2-c4b301cdf627,com.danvelazco.fbwrapper,after 6 months use and latest update it has started crashing when opening messages,feature,resource management
7c2ad7ca-afc9-11e6-ba6a-c4b301cdf627,com.danvelazco.fbwrapper,works but the last few days when i tried going into any messages whether through inbox or or on someones wall it crashes and shuts down,feature,resource management
7c2ad8cc-afc9-11e6-ace8-c4b301cdf627,com.danvelazco.fbwrapper,was a solid 5 until messenger broke can someone fix the messenger function the app crashes when trying to load messages,feature,resource management
7c2ad94f-afc9-11e6-a9f9-c4b301cdf627,com.danvelazco.fbwrapper,outstanding messenger causes the app to crash this is otherwise an excellent app the facebook app always seemed to slow down my phone and kill the battery,feature,resource management
7c2ad9d1-afc9-11e6-a95a-c4b301cdf627,com.danvelazco.fbwrapper,messages dont work app force closes when trying to open an individual message,feature,resource management
7c2ada4a-afc9-11e6-9537-c4b301cdf627,com.danvelazco.fbwrapper,pitiful click on notifications icon crashed reloaded and have to login all over again crapware,feature,resource management
7c2adaca-afc9-11e6-bbf2-c4b301cdf627,com.danvelazco.fbwrapper,force closing on messages thanks to fb annoying marketing on the new messenger app when you enter the messages section tinfoil gets forced closes,feature,resource management
7c2adb45-afc9-11e6-b6d2-c4b301cdf627,com.danvelazco.fbwrapper,crashes when viewing messages used the app for over a year and a half with no problems until last week everytime you click on your messages the app crashes without fail please fix it would be 5 stars without this problem,feature,resource management
7c2adbc5-afc9-11e6-a8d7-c4b301cdf627,com.danvelazco.fbwrapper,facebook fights this app love this app but please fix the messenger crashing or popping up playstore to install fb messenger,feature,resource management
7c2adc47-afc9-11e6-857e-c4b301cdf627,com.danvelazco.fbwrapper,new problem crashes everytime i try to go to messages worked fine beforeew problem crashes everytime i try to go to mew problem crashes,feature,resource management
7c2adcca-afc9-11e6-ac51-c4b301cdf627,com.danvelazco.fbwrapper,i like the app but just recently it started crashing when i tried to open messenger,feature,resource management
