id,package,review,merged_main,merged_second
6c2e4c19-afdf-11e6-be22-b252784303c8,com.fsck.k9,from 5 to 3 since the last few update all it does is freeze up or crash this was my go to email app for all my android devices recommended to all family friends and coworkers not anymore looking for a good replacement,update,
749cf563-afdf-11e6-be22-b252784303c8,com.fsck.k9,broke on tablet crashes on samsung wifi only works great on my husbands s5 please fix,not meaningful,
a7a05783-bda7-11e6-9d51-fa163e345ce9,com.fsck.k9,used to work well but its been crashing and hanging constantly and it takes forever to get thru my email needs serious fixes,not meaningful,
3848d1b5-c003-11e6-8955-fa163e345ce9,com.fsck.k9,so far no crashes on this phone however how do i print an email also scroll bar still interfering with message stars grrr,not meaningful,
cc6e045f-ce26-11e6-998a-fa163e345ce9,com.fsck.k9,updating and crashing since the update all i can do is upgrade folders then it crashes i hope a fix is coming soon,update,
067ae85c-d083-11e6-9556-fa163e345ce9,com.fsck.k9,5201 is a nonstarter broken zoom frequenct crashes ive reverted my install to 5010 it isnt perfect but it works in 5201 zoom is broken and it crashed a few times in the few hours ive had it installed unacceptable especially the broken zoom,update,
0fac6c84-d083-11e6-9556-fa163e345ce9,com.fsck.k9,was great until recent update once i open mail it crashes out,update,
144e5657-d083-11e6-9556-fa163e345ce9,com.fsck.k9,has trouble with sorting and deleting crashes trying to delete imap messages every time although it is the only app i found capable of sorting messages and showing internet headers the reliability of some of these advanced function is only soso for large numbers of messages 10k sorting by sender does not appear to work at all and sorting by date sent vs received date only sort of worked so overall a bit disappointing,feature,
506dfbc7-d215-11e6-a0f0-fa163e345ce9,com.fsck.k9,poor after update was great till recent update that crashes its database some emails that can be opened previously now not able to now even manual fetching of email become so slow and sometimes hang,update,
550b9fdf-d215-11e6-a0f0-fa163e345ce9,com.fsck.k9,what are you doing with a nice app crash and slow please cancel you update and go back to the working one worked smooth for years but not anymore i hate when a nice app is spoiled by bad developers,update,
5a5d51b6-d215-11e6-a0f0-fa163e345ce9,com.fsck.k9,new version crashes ive been using k9 for years but you ruined it in this release 1everything is suddenly a lot slower 2app crashes while scrolling through messages in sent folder 3app no longer goes straight to inbox from phones notification bar goes to folder list instead 4why do you now have contacts pictures or initials on new messages and how do you turn this off 5why the new drop down for cc bcc etc its too big the old button was fine ill try to an downgrade older version for now or use something el,update,feature
5a93a3f8-d215-11e6-a0f0-fa163e345ce9,com.fsck.k9,crashing after last update was working well until yesterdays update now its just closing without any messages when opening email not on all but on most emails pls return previous version,update,feature
5c4328be-d215-11e6-a0f0-fa163e345ce9,com.fsck.k9,worked perfectly in previous versions however v5201 crashes whenever one steels to view an email on samsung galaxy s5,update,feature
08bff66f-d604-11e6-883f-fa163e345ce9,com.fsck.k9,poor updates recently pinch zoom into emails no longer working stability issues and crashes when viewing some emails long time user and disappointed in steps backwards,update,feature
0c5fb17e-d604-11e6-883f-fa163e345ce9,com.fsck.k9,latest update is hopeless now cant send emails from one of my accounts update fixed by recreating accounts every folder had to be recreated the new send screen is of poor design with the contacts taking up too much room the app now crashes every so often didnt happen before very disappointed,update,feature
0f3a48c9-d604-11e6-883f-fa163e345ce9,com.fsck.k9,please fix the latest updates have ruined this oncegreat app it crashes forcecloses and when i reply to messages all the text that i am replying to is a dark blue and cannot be seen i even downloaded earlier versions to install but v50 which might fix the problem fails to see my import backup file so until its fixed were all just stuck why update an app that was working im a longtime user but will have to switch apps if this isnt fixed,update,feature
10a87ed0-d604-11e6-883f-fa163e345ce9,com.fsck.k9,great app have used it for some time unfortunately started crashing every minute so frustrating had to finally uninstall cant give higher rating until latest updates get fixed,not meaningful,
1ea6a63f-d604-11e6-883f-fa163e345ce9,com.fsck.k9,used to like it crashes constantly i also dont understand why i cannot move emails in trash deleted in error back into my inbox its just not possible and should be in the trash can they cannot be fully loaded or replied to,not meaningful,
334afc78-d795-11e6-8f17-fa163e345ce9,com.fsck.k9,latest version is bad 5 stars prior to latest version now 2 stars the latest version introduced many bugs you can no longer zoom text delete a message causes app to crash scroll to previous message causes crash it seems to always end abruptly there are probably more problems but i dont want look for them,update,feature
389e830f-d795-11e6-8f17-fa163e345ce9,com.fsck.k9,what are you doing with a nice app crash and slow worked smooth for years but not anymore i hate when a nice app is spoiled by bad developers,not meaningful,
3a55f718-d795-11e6-8f17-fa163e345ce9,com.fsck.k9,update killed it regular force closes s5 phone,update,
7dfdde14-d927-11e6-b326-fa163e345ce9,com.fsck.k9,latest updates have destroyed great app no crashes ever until 2017 updates now crashes every 30 seconds cannot read a full email before it crashes please roll back to 2016 and test before reupdating,update,
7e38eb45-d927-11e6-b326-fa163e345ce9,com.fsck.k9,what are you doing with a nice app taskbar problems slow minor crash cant zoom all have worked but not anymore worked smooth for years but not anymore i hate when a nice app is spoiled by bad developers,update,feature
7f376f8a-d927-11e6-b326-fa163e345ce9,com.fsck.k9,freezes and crashes incessantly and sometimes eats messages in composition i have been using k9 mail for over 2 years due to being stuck with pop3 service on verizon and k9 mail has increasingly tended to freeze up and sometimes crash after the update to the latest version available on january 3 2017 it stopped working entirely it also sometimes loses messages in composition without saving a draft switched to blue mail which is missing some features important for pop3 but at least works,update,feature
81f05a57-db83-11e6-8eeb-fa163e345ce9,com.fsck.k9,best android email app thank you for such a terrific free app the latest version has lots of cool features may i suggest some featuresfixes a setting to allow attachment list to appear on top or below message body last update moved it to the bottom where they can be missed make confirm optional on mark all messages as read searches on a large database makes screen go black for a few seconds and then crashes on longer search strings delete message from home task list deletes message but dialog box can remain,resource management,
152d231f-dd15-11e6-a745-fa163e345ce9,com.fsck.k9,bugs search function and trying to read asent mail results in a crash,feature,
862b5425-dea7-11e6-ab42-fa163e345ce9,com.fsck.k9,thank you for such a terrific free app the latest version has lots of cool features may i suggest some featuresfixes a setting to allow attachment list to appear on top or below message body last update moved it to the bottom where they can be missed make confirm optional on mark all messages as read searches on a large database makes screen go black for a few seconds and then crashes on longer search strings delete message from home task list deletes message but dialog box can remain,resource management,
8792d36c-dea7-11e6-ab42-fa163e345ce9,com.fsck.k9,used to be good butnthe new version crashes constantly even when i am using other apps i had to uninstall it,update,
93336820-e103-11e6-8fa8-fa163e345ce9,com.fsck.k9,since one of the latest updates it crashes quite often but definitely does not let me to delete or mark read from notification samsung s7,update,feature
9ac238be-e103-11e6-8fa8-fa163e345ce9,com.fsck.k9,latest update is useless pinch to zoom doesnt work crashes regularly and runs ridiculously slowly please fix it urgently,update,feature
9bc020c3-e103-11e6-8fa8-fa163e345ce9,com.fsck.k9,latest update breaks pinchtozoom and crashes app occasionally and polling folders is much slower than before whatever the database update did made app interface and retrieving and searching messages sloooooower motorola droid maxx,update,feature
2484bde3-e47e-11e6-b02a-fa163e345ce9,com.fsck.k9,still crashing after most recent update wish you could move an email between email accounts,update,
137518c6-e869-11e6-ba6b-fa163e345ce9,com.fsck.k9,still crashing frrquently after most recent update recently crashed while drafting email and i lost all the email i had typed wish you could move an email between email accounts longtime user but frequent crashing has caused me to switch email apps,update,feature
a922f7e6-e9a7-11e6-aa52-fa163e345ce9,com.fsck.k9,ive been using k9 for years and have loved it but the last 3 or so updates have been horrible slowed the app down and caused often crashes im going to find an old version until this is resolved,update,
0308c7c4-ec04-11e6-a3aa-fa163e345ce9,com.fsck.k9,latest update is useless pinch to zoom doesnt work crashes regularly and runs ridiculously slowly please fix it urgently ok pinch to zoom now fixed still running like a tortoise and crashing all the time,update,feature
afc852f0-ed95-11e6-8610-fa163e345ce9,com.fsck.k9,latest updates is causing the app to constantly crash on my samsung you cant compose an email as it will crash while you are doing so,update,feature
79b1a2e8-f31b-11e6-885c-000c29dba5da,com.fsck.k9,i thought it was doing okay but keeps crashing reduced rating down from 45 to 25 im not willing to send report because the report button doesnt allow me to see whats being collected and for me to choose or approve i greatly appreciate being able to export settings receipts many other features other than the need to fix crash problem i can only suggest 3 things 1 allow messages to be date grouped in the inbox with header title being a date like the way the default stock email app does it on samsung galaxy phones 2 allow to only download headers again like default email app 3 allow emails to not be syncedstored on phone especially when setup as an imap connection,not meaningful,
7cdcf243-f31b-11e6-885c-000c29dba5da,com.fsck.k9,app crawls to a halt crashes frequently i suspect that the app can no longer handle large amounts of imap email please fix this,resource management,
91aa6686-f4aa-11e6-8dd5-000c29dba5da,com.fsck.k9,really wanted to love it but last couple updates really screwed it up huge lag when getting emails date sorting is wrong crashes when adding attachments to emails sending errors all basic email functions that should just work sorry,update,feature
12dae756-fb75-11e6-8508-000c29dba5da,com.fsck.k9,this app used to be great but recently has gone down hill crashes about twice a day takes forever to process requests eg to open a message also crashes when deleting messages,feature,
78d47443-1414-11e7-8f31-000c29dba5da,com.fsck.k9,came back to see if it would would work on my phone and it crashed htc one m9,not meaningful,
823767a8-1414-11e7-8f31-000c29dba5da,com.fsck.k9,conceptually good and a decent design but a totally unreliable piece of software im not the most demanding app user but i prefer programs to not crash every single time i use them while im using them especially something as crucial as a mail client look elsewhere for your email needs,not meaningful,
d465a3ce-15a4-11e7-9dbd-000c29dba5da,com.fsck.k9,this app used to be good on the s7 however now constant sync disable messages show up and are you there have to force close the app or turn off the wifi and then turn it back on to refresh and get new emails but who wants to keep doing that all day also blinking light notification no longer works unless you use sound or vibrate due to all of these issues with the application that i can no longer recommend it to anyone until they get fix it,not meaningful,
4841add3-2302-11e7-8e68-000c29dba5da,com.fsck.k9,update it became so bad after updates very slow downloading new mails crashes when deleting mails reply rarely works now uninstalled and using a different app,update,feature
943f65e2-62a8-11e7-9a67-000c29dba5da,com.fsck.k9,unfortunally crashes all the time within 1 minute on marshmallow,not meaningful,
aa6f942a-6879-11e7-ad17-000c29dba5da,com.fsck.k9,latest update is hopeless now cant send emails from one of my accounts update fixed by recreating accounts every folder had to be recreated the new send screen is of poor design with the contacts taking up too much room the app now crashes every so often didnt happen before very disappointed 717 all of a sudden it cant connect to my yahoo account authentication failed whats going on started working again without any changes from me rating back up to 4,update,feature
aebf1834-6879-11e7-ad17-000c29dba5da,com.fsck.k9,july 2017 update still crashing frrquently i have sent dozens of crash reports most often crashes when reading email and rotating my phone from portrait to landscape with certain emails problem is repeatable every time wish you could move an email between email accounts longtime user but frequent crashing has caused me to switch email apps,feature,
56b13bc6-7897-11e7-94d3-000c29dba5da,com.fsck.k9,it just works ive been using k9 for over a year with three email accounts its never crashed and its always worked i like it better than my laptop email program,wrong,
7cc35f66-afc9-11e6-9747-c4b301cdf627,com.eleybourn.bookcatalogue,scanner crashed everytime i try to scan an isbn the app crashes but if i enter the isbn manually its fine i downloaded this app strictly for the scanner feature who has time to enter hundreds of numbers manually,feature,
7cc36f61-afc9-11e6-8bc0-c4b301cdf627,com.eleybourn.bookcatalogue,great app unlike the goodreads app you can look at your library without any sort of internet which is great not only that but you can import your goodreads library this app saved me from having to redo my entire library bit of a issue with the scanner crashing every once and awhile but other then that i have no complaints would definitely recommend this app to all book readers and collectors,resource management,
7cc39761-afc9-11e6-9f62-c4b301cdf627,com.eleybourn.bookcatalogue,needs an update love that this app will sort by genre however hate it is not shareable with my family another complaint is that every time i try to scan the barcodeisbn the app crashes so im having to put our books in manually to get them sorted by genre,feature,
7cc3c16b-afc9-11e6-aca8-c4b301cdf627,com.eleybourn.bookcatalogue,just what i wanted i have been looking for an app just like this and now ive found it i now have my entire library in my hand no more accidentally buying double copies i can even mark the ones ive already read one of the few apps on my phone that works just how it should happen has never crashed on me there are no ads and not once has it asked me for money,wrong,
7cc3c99e-afc9-11e6-bbba-c4b301cdf627,com.eleybourn.bookcatalogue,what a wonderfully designed app content well organized and easy to use iv already scanned 350 books i can think of nothing to improve this app the only issue ive encountered is sometimes the app just closes down while im using it when i reopen nothing is lost so no big deal im searching to see if this developer has an app for movies thank you for such a great app,not meaningful,
7cc417dc-afc9-11e6-8ad7-c4b301cdf627,com.eleybourn.bookcatalogue,crashes fixed with new update thanks for prompt response to the comments about the failed update since update crashes all time app is essential to use with cataloguing book collection and causing big problems for me,wrong,
7cc41868-afc9-11e6-b819-c4b301cdf627,com.eleybourn.bookcatalogue,crashing crashing upon opening app since update today will change rating when satisfactorily resolved samsung note pro and samsung note 3,update,
7cc418e8-afc9-11e6-887a-c4b301cdf627,com.eleybourn.bookcatalogue,oh no it just crashed please fux asap i love this app and have a lot of info stored,not meaningful,
7cc41975-afc9-11e6-a90f-c4b301cdf627,com.eleybourn.bookcatalogue,updated and now crashes the app updated itself and now crashesit wont open,update,
7cc4432e-afc9-11e6-9b3f-c4b301cdf627,com.eleybourn.bookcatalogue,works great many features ive been using this app since 2012 and now have it on my m8 w android 442 i only have about 1000 books but its perfect for my needs fast and has never hung or crashed on me,wrong,
f091a28e-5093-11e7-8996-000c29dba5da,com.eleybourn.bookcatalogue,i have been looking for an app just like this and now ive found it i now have my entire library in my hand no more accidentally buying double copies i can even mark the ones ive already read one of the few apps on my phone that works just how it should happen has never crashed on me there are no ads and not once has it asked me for money,wrong,
7c2a2b68-afc9-11e6-a447-c4b301cdf627,com.danvelazco.fbwrapper,crashes opening pms any fix for this love the ap,feature,
7c2a2d66-afc9-11e6-a131-c4b301cdf627,com.danvelazco.fbwrapper,what the hell happened to this app this used to be such a great app and now it seems like its been left to die a slow death there is no support and i have to keep refreshing the page everytime i click on a post it crashes every 5 minutes sad,not meaningful,
7c2a2dde-afc9-11e6-855a-c4b301cdf627,com.danvelazco.fbwrapper,buggy crashes every time i open messages,feature,
7c2a3142-afc9-11e6-a0f3-c4b301cdf627,com.danvelazco.fbwrapper,was good but doesnt work right anymore i honestly think its facebook sabotaging apps like this first with the messaging crashing the app but now it messes up while typing its a bit difficult to explain but it erases letters replaces them to the point that you cant write a coherent sentence without taking extra effort to fix it,feature,
7c2a39c7-afc9-11e6-90e7-c4b301cdf627,com.danvelazco.fbwrapper,was good but slipping it was great for a while then started crashing when you try to read messages then it would show notification alert but the notifications werent there until refresh now its decided i dont have any friends should get some so it can show me things even though it still shows i have 200,feature,
7c2a3ba8-afc9-11e6-9633-c4b301cdf627,com.danvelazco.fbwrapper,nice but crashes when i open messages nexus 6p android 711,feature,
7c2a3ca3-afc9-11e6-8d12-c4b301cdf627,com.danvelazco.fbwrapper,force closes when looking at messages everything is good but it force closes when looking at messages on my moto e dont understand why everything else works fine,feature,
7c2a3dcc-afc9-11e6-8181-c4b301cdf627,com.danvelazco.fbwrapper,works as advertised great app spam freefor a user below that said it crashes when accessing messengerreason is messenger is a creepy fb feature that have your mic and camera turned on 247so tinfoil disabled this as a featurethis does not prevent you from downloading a messenger app,android,
7c2a3e59-afc9-11e6-858b-c4b301cdf627,com.danvelazco.fbwrapper,crashes on messages i would give this 5 stars but it crashes every time i try to access my messages in the app i have removed and reinstalled the app signed in and out even reformatted my phone but it still crashes when i click messages every time without fail,feature,
7c2a3edc-afc9-11e6-95db-c4b301cdf627,com.danvelazco.fbwrapper,great for low memory phones lets face it the official fb app keeps getting more bloated with every useless update and then forcing messenger on us to im people was a dumb move luckily this app fixes all of that its all in one the way it should be theres a couple little things that id gripe about but its nothing compared to how the official app is lol edit 23 oct 2016 had to switch to another app since messages dont work anymore the app will either force close or go to play store,not meaningful,
7c2a40e3-afc9-11e6-a81d-c4b301cdf627,com.danvelazco.fbwrapper,app crashes every time i open messages or try to message which means i just have to use fb messenger which sucks but whatever still a good easy app,feature,
7c2a41ab-afc9-11e6-912b-c4b301cdf627,com.danvelazco.fbwrapper,great except msgs perfect but crashes every time i access messages would be five star otherwise,feature,
7c2a42c2-afc9-11e6-b5a1-c4b301cdf627,com.danvelazco.fbwrapper,app crashes the app crashes when i press the messages button,feature,
7c2a43bd-afc9-11e6-a5fc-c4b301cdf627,com.danvelazco.fbwrapper,this app crashes a lot i like the concept here though the official app uses almost a gigabyte of space on my phone and constantly runs in the background,not meaningful,
7c2a44b8-afc9-11e6-ac02-c4b301cdf627,com.danvelazco.fbwrapper,so far so good i like ti a lot only one issue so far it crashes every time i hit the messages button,feature,
7c2a483a-afc9-11e6-8170-c4b301cdf627,com.danvelazco.fbwrapper,its a great app but its a great app but it crashes when i open messages and that was the main reason i installed it so i could avoid having to use messenger i might as well install the official facebook app,feature,
7c2a4bab-afc9-11e6-8194-c4b301cdf627,com.danvelazco.fbwrapper,crashes every time wit fb personal message i prefer this app to fb but it is a nuisance that it crashes every time i attempt to access personal messages that are apparently waiting for me this bug is consistent across my two devices i see other users have reported the same frustrating problem but the developer shows no interest in fixing it i hope they do fix it as it is otherwise useful,feature,
7c2a5105-afc9-11e6-af58-c4b301cdf627,com.danvelazco.fbwrapper,great app but facebook are slowly breaking it first facebook blocked the api for messaging so the app crashes every time you try to access it and now it seems like theyve blocked events as well any chance of a fix or workaround managing events is pretty much the main reason i use facebook,feature,
7c2a5280-afc9-11e6-94a6-c4b301cdf627,com.danvelazco.fbwrapper,moto g3 messages menu crashes app on moto g3 otherwise perfect,feature,
7c2a537a-afc9-11e6-bf40-c4b301cdf627,com.danvelazco.fbwrapper,annoyed i am having a problem with checking my messages it crashes every time i open it and i tried reinstalled and installed and nope still crashes i emailed 4 different times and no response and not fixed still either its been months btw also as of today i cant post smiley face characters from facebook this app sucks,feature,
7c2a5475-afc9-11e6-8d1c-c4b301cdf627,com.danvelazco.fbwrapper,messages crashes app every time if i try to look at any messages the app crashes,feature,
7c2a56eb-afc9-11e6-b90d-c4b301cdf627,com.danvelazco.fbwrapper,cant open messages app crashes when i open up private messaging,feature,
7c2a5763-afc9-11e6-bbe0-c4b301cdf627,com.danvelazco.fbwrapper,dont bother you click on messages the app crashes no thank you,feature,
7c2a5821-afc9-11e6-840a-c4b301cdf627,com.danvelazco.fbwrapper,decent facebook app ive been using this app for a few years i begun using it because the size is smaller than the official app and also the privacy but ive stayed with it because it barely glitches and is still fast and doesnt take up much space i would give it 5 stars but the app crashes every time i try to check my messages on it,feature,
7c2a5cb3-afc9-11e6-84f4-c4b301cdf627,com.danvelazco.fbwrapper,could be better why cant i copy pages as links to paste into other threads there should be the option to do that plus messages are broken and crash the app everytime i try to view them this may be something fb have done in trying to force everyone to download their awful app but could that also be looked at,feature,
7c2a5e91-afc9-11e6-b7b7-c4b301cdf627,com.danvelazco.fbwrapper,kept crashing back to back so uninstalled,not meaningful,
7c2a5f17-afc9-11e6-be5d-c4b301cdf627,com.danvelazco.fbwrapper,great small ram footprint much faster and privacy however mine seems to crash when i tap the messages icon on top,feature,
7c2a6380-afc9-11e6-b070-c4b301cdf627,com.danvelazco.fbwrapper,messages crash app app crashes every time i try to open messages for me it almost defeats the purpose of having this app since i will have to get the fb messenger app to read them anyway without my computer ive been sending error reports for months whenever this happens and no fix,feature,
7c2a64fa-afc9-11e6-a63f-c4b301cdf627,com.danvelazco.fbwrapper,cant use messaging every time i try to open messages the app force closes now its useless to me,feature,
7c2a6947-afc9-11e6-aa5b-c4b301cdf627,com.danvelazco.fbwrapper,developer no longer updating the app was a 5 app but after facebook made it mandatory to use messenger on mobile browser this app started crashing,not meaningful,
7c2a6acc-afc9-11e6-b3ed-c4b301cdf627,com.danvelazco.fbwrapper,messages crash crashes when trying to open messages,feature,
7c2a6b4f-afc9-11e6-b12a-c4b301cdf627,com.danvelazco.fbwrapper,crashes when trying to access messages i think its because facebook is serving a play store popup on the mobile site,feature,
